{
  "schema_version": "run-record/3.0",
  "run_id": "run-grok-xai-1430b6bade8c-1790260048-ce837e2f",
  "recorded_at": "2026-09-24T14:27:40Z",
  "runner": "cli",
  "provider": "grok",
  "endpoint_kind": "xai",
  "model": "grok-4.5",
  "model_alias": null,
  "runtime_sha": "0c26652cd13416b402d4c0b8f1bf9ec7b17de8c1",
  "prompt_sha256": "166a8e4b0bf91ffc78d53a2df61332b71ae47e1cd12626b4181df6e71d9582c0",
  "extension_sha256": null,
  "sampling": {
    "requested": {},
    "sent": {},
    "stripped": []
  },
  "context": {
    "repo_kind": "fixture_tree",
    "head_sha": "1430b6bade8c12a5a9dcab1c42223fbfe7650494",
    "base_sha": "4884919a5f79d568f015f89a83486f421402d766",
    "corpus_case_id": "C090",
    "corpus_sha256": "0124cdabb98b58893d1b81e0f6a1fbe297338d1dea9c40eaf3c359f2b2937ec4",
    "changed_files": 1,
    "omitted_files": 1,
    "diff_chars": 0,
    "diff_truncated": false,
    "iar_mode": "none",
    "instruction_files_read": []
  },
  "budget": {
    "max_turns": 30,
    "turns_used": 4,
    "tool_calls": 0,
    "risk_tier": "elevated",
    "verifier_runs": 1
  },
  "outcome": {
    "findings_total": 1,
    "findings_by_severity": {
      "critical": 1,
      "warning": 0,
      "info": 0
    },
    "findings_verified": 1,
    "findings_downgraded": 0,
    "findings_refuted": 0,
    "summary_present": true,
    "gate": {
      "strictness": "lenient",
      "passed": true
    },
    "score": {
      "must_find_total": 1,
      "must_find_hits": 1,
      "false_positives": 0,
      "unlabelled": 0,
      "adjudicated_true": null,
      "adjudicated_false": null
    }
  },
  "usage_known": true,
  "usage": {
    "input_tokens": 17732,
    "cache_read_tokens": 101504,
    "cache_write_tokens": 0,
    "output_tokens": 2920,
    "source": "cli"
  },
  "cost_usd": 0.0834352,
  "cost_basis": "vendor-reported",
  "timings": {
    "setup_seconds": 0.169,
    "provider_seconds": 70.22,
    "verifier_seconds": 12.138,
    "total_seconds": 70.391
  },
  "status": "completed",
  "failure_class": null,
  "campaign": {
    "id": "phase4-tiers-fixed",
    "cell": "grok|fixed|C090",
    "repetition": 2,
    "arm": "fixed"
  }
}
