{
  "schema_version": "run-record/3.0",
  "run_id": "run-grok-xai-2d44c1bf822f-1790255421-c293f63a",
  "recorded_at": "2026-09-24T13:10:29Z",
  "runner": "cli",
  "provider": "grok",
  "endpoint_kind": "xai",
  "model": "grok-4.5",
  "model_alias": null,
  "runtime_sha": "7695481624f116a990b80d38255d24ed5bb145b1",
  "prompt_sha256": "166a8e4b0bf91ffc78d53a2df61332b71ae47e1cd12626b4181df6e71d9582c0",
  "extension_sha256": null,
  "sampling": {
    "requested": {},
    "sent": {},
    "stripped": []
  },
  "context": {
    "repo_kind": "fixture_tree",
    "head_sha": "2d44c1bf822f9d76a86e688529bda784a866c5f9",
    "base_sha": "5df528b817c2ea4df48682616394cdefb03a1849",
    "corpus_case_id": "C003",
    "corpus_sha256": "0febf863950cbe1d33e283b93c48460fb5743694f3112b65babd21380e9a4eff",
    "changed_files": 1,
    "omitted_files": 0,
    "diff_chars": 545,
    "diff_truncated": false,
    "iar_mode": "none",
    "instruction_files_read": []
  },
  "budget": {
    "max_turns": 30,
    "turns_used": 4,
    "tool_calls": 0,
    "risk_tier": "standard",
    "verifier_runs": 1
  },
  "outcome": {
    "findings_total": 1,
    "findings_by_severity": {
      "critical": 1,
      "warning": 0,
      "info": 0
    },
    "findings_verified": 1,
    "findings_downgraded": 0,
    "findings_refuted": 0,
    "summary_present": true,
    "gate": {
      "strictness": "lenient",
      "passed": true
    },
    "score": {
      "must_find_total": 1,
      "must_find_hits": 1,
      "false_positives": 0,
      "unlabelled": 0,
      "adjudicated_true": null,
      "adjudicated_false": null
    }
  },
  "usage_known": true,
  "usage": {
    "input_tokens": 29960,
    "cache_read_tokens": 86784,
    "cache_write_tokens": 0,
    "output_tokens": 1398,
    "source": "cli"
  },
  "cost_usd": 0.0943432,
  "cost_basis": "vendor-reported",
  "timings": {
    "setup_seconds": 0.039,
    "provider_seconds": 33.901,
    "verifier_seconds": 7.254,
    "total_seconds": 33.941
  },
  "status": "completed",
  "failure_class": null,
  "campaign": {
    "id": "phase4-tiers-fixed",
    "cell": "grok|fixed|C003",
    "repetition": 0,
    "arm": "fixed"
  }
}
