{
  "schema_version": "run-record/3.0",
  "run_id": "run-grok-xai-e3548f403bc3-1790256599-13a8542d",
  "recorded_at": "2026-09-24T13:30:07Z",
  "runner": "cli",
  "provider": "grok",
  "endpoint_kind": "xai",
  "model": "grok-4.6",
  "model_alias": "deep",
  "runtime_sha": "7695481624f116a990b80d38255d24ed5bb145b1",
  "prompt_sha256": "166a8e4b0bf91ffc78d53a2df61332b71ae47e1cd12626b4181df6e71d9582c0",
  "extension_sha256": null,
  "sampling": {
    "requested": {},
    "sent": {},
    "stripped": []
  },
  "context": {
    "repo_kind": "fixture_tree",
    "head_sha": "e3548f403bc3d7518e4bfbb5856fcbb4d47f9f9c",
    "base_sha": "cd66a8eeef1c57ce28ceaa543067e04d7b66ad03",
    "corpus_case_id": "C010",
    "corpus_sha256": "720bd2514d466be944b410b18a226d4bbfc67b057e1bee729866084b530e9bc3",
    "changed_files": 1,
    "omitted_files": 0,
    "diff_chars": 662,
    "diff_truncated": false,
    "iar_mode": "none",
    "instruction_files_read": []
  },
  "budget": {
    "max_turns": 40,
    "turns_used": 5,
    "tool_calls": 0,
    "risk_tier": "critical",
    "verifier_runs": 1
  },
  "outcome": {
    "findings_total": 1,
    "findings_by_severity": {
      "critical": 1,
      "warning": 0,
      "info": 0
    },
    "findings_verified": 1,
    "findings_downgraded": 0,
    "findings_refuted": 0,
    "summary_present": true,
    "gate": {
      "strictness": "lenient",
      "passed": true
    },
    "score": {
      "must_find_total": 1,
      "must_find_hits": 1,
      "false_positives": 0,
      "unlabelled": 0,
      "adjudicated_true": null,
      "adjudicated_false": null
    }
  },
  "usage_known": true,
  "usage": {
    "input_tokens": 31587,
    "cache_read_tokens": 117376,
    "cache_write_tokens": 0,
    "output_tokens": 2838,
    "source": "cli"
  },
  "cost_usd": 0.13889,
  "cost_basis": "vendor-reported",
  "timings": {
    "setup_seconds": 0.046,
    "provider_seconds": 58.942,
    "verifier_seconds": 8.424,
    "total_seconds": 58.991
  },
  "status": "completed",
  "failure_class": null,
  "campaign": {
    "id": "phase4-critical-1",
    "cell": "grok|critical|C010",
    "repetition": 0,
    "arm": "critical"
  }
}
