{
  "schema_version": "run-record/3.0",
  "run_id": "run-grok-xai-0012cfd35d82-1790257514-908c025f",
  "recorded_at": "2026-09-24T13:45:28Z",
  "runner": "cli",
  "provider": "grok",
  "endpoint_kind": "xai",
  "model": "grok-4.5",
  "model_alias": null,
  "runtime_sha": "7695481624f116a990b80d38255d24ed5bb145b1",
  "prompt_sha256": "166a8e4b0bf91ffc78d53a2df61332b71ae47e1cd12626b4181df6e71d9582c0",
  "extension_sha256": null,
  "sampling": {
    "requested": {},
    "sent": {},
    "stripped": []
  },
  "context": {
    "repo_kind": "fixture_tree",
    "head_sha": "0012cfd35d8254fec9835b6cfee02e71d9af7a21",
    "base_sha": "51c61330dc41d0fd6058a39ee3304e38e9fe4e0f",
    "corpus_case_id": "C021",
    "corpus_sha256": "46a1d071f65613c4e0a9d74dfee246eceacfdb053815b5db947a96e04586f7da",
    "changed_files": 1,
    "omitted_files": 0,
    "diff_chars": 397,
    "diff_truncated": false,
    "iar_mode": "none",
    "instruction_files_read": []
  },
  "budget": {
    "max_turns": 30,
    "turns_used": 4,
    "tool_calls": 0,
    "risk_tier": "elevated",
    "verifier_runs": 2
  },
  "outcome": {
    "findings_total": 2,
    "findings_by_severity": {
      "critical": 2,
      "warning": 0,
      "info": 0
    },
    "findings_verified": 2,
    "findings_downgraded": 0,
    "findings_refuted": 0,
    "summary_present": true,
    "gate": {
      "strictness": "lenient",
      "passed": true
    },
    "score": {
      "must_find_total": 1,
      "must_find_hits": 1,
      "false_positives": 0,
      "unlabelled": 0,
      "adjudicated_true": null,
      "adjudicated_false": null
    }
  },
  "usage_known": true,
  "usage": {
    "input_tokens": 17156,
    "cache_read_tokens": 100992,
    "cache_write_tokens": 0,
    "output_tokens": 2343,
    "source": "cli"
  },
  "cost_usd": 0.0786676,
  "cost_basis": "vendor-reported",
  "timings": {
    "setup_seconds": 0.129,
    "provider_seconds": 59.552,
    "verifier_seconds": 14.001,
    "total_seconds": 59.682
  },
  "status": "completed",
  "failure_class": null,
  "campaign": {
    "id": "phase4-tiers-auto",
    "cell": "grok|auto|C021",
    "repetition": 2,
    "arm": "auto"
  }
}
