{
  "schema_version": "run-record/3.0",
  "run_id": "run-grok-xai-2c0797b122f6-1790211983-24bed1e2",
  "recorded_at": "2026-09-24T01:06:23Z",
  "runner": "cli",
  "provider": "grok",
  "endpoint_kind": "xai",
  "model": "grok-4.5",
  "model_alias": null,
  "runtime_sha": "4e469f0c6687d1e3421d9bbeade5412cace10d18",
  "prompt_sha256": "166a8e4b0bf91ffc78d53a2df61332b71ae47e1cd12626b4181df6e71d9582c0",
  "extension_sha256": null,
  "sampling": {
    "requested": {},
    "sent": {},
    "stripped": []
  },
  "context": {
    "repo_kind": "fixture_tree",
    "head_sha": "2c0797b122f605a47ddd5ed264eca9cc7fe0815f",
    "base_sha": "591b5bc50d64329cd931fa88139f42e7807a786d",
    "corpus_case_id": "C069",
    "corpus_sha256": "de3ffde9c1cf839d7f319c60ebd2216e794766973bae77c1fd770b988c53c7a0",
    "changed_files": 1,
    "omitted_files": 0,
    "diff_chars": 667,
    "diff_truncated": false,
    "iar_mode": "none",
    "instruction_files_read": []
  },
  "budget": {
    "max_turns": 30,
    "turns_used": 4,
    "tool_calls": 0,
    "risk_tier": "unclassified",
    "verifier_runs": 0
  },
  "outcome": {
    "findings_total": 1,
    "findings_by_severity": {
      "critical": 0,
      "warning": 1,
      "info": 0
    },
    "findings_verified": 0,
    "findings_downgraded": 0,
    "findings_refuted": 0,
    "summary_present": true,
    "gate": {
      "strictness": "lenient",
      "passed": true
    },
    "score": {
      "must_find_total": 1,
      "must_find_hits": 1,
      "false_positives": 0,
      "unlabelled": 0,
      "adjudicated_true": null,
      "adjudicated_false": null
    }
  },
  "usage_known": true,
  "usage": {
    "input_tokens": 18059,
    "cache_read_tokens": 102144,
    "cache_write_tokens": 0,
    "output_tokens": 2181,
    "source": "cli"
  },
  "cost_usd": 0.0798472,
  "cost_basis": "vendor-reported",
  "timings": {
    "setup_seconds": 0.036,
    "provider_seconds": 35.911,
    "verifier_seconds": null,
    "total_seconds": 35.948
  },
  "status": "completed",
  "failure_class": null,
  "campaign": {
    "id": "phase1-precision-off",
    "cell": "grok|baseline|C069",
    "repetition": 1,
    "arm": "baseline"
  }
}
