{
  "schema_version": "run-record/3.0",
  "run_id": "run-grok-xai-f79104eebd36-1790192909",
  "recorded_at": "2026-09-23T19:48:29Z",
  "runner": "cli",
  "provider": "grok",
  "endpoint_kind": "xai",
  "model": "grok-4.5",
  "model_alias": null,
  "runtime_sha": "426aa0eb574dafd17b99ae087d400b367a05b0ea",
  "prompt_sha256": "ecd63c769299564f3fb0a1b245c677fde7e1af51815d914d44b9b38838678b66",
  "extension_sha256": null,
  "sampling": {
    "requested": {},
    "sent": {},
    "stripped": []
  },
  "context": {
    "repo_kind": "fixture_tree",
    "head_sha": "f79104eebd366479a651f5bbae5452d834326c15",
    "base_sha": "166c31f4cb8164aed8b1106cf06b29ad61242459",
    "corpus_case_id": "C011",
    "corpus_sha256": "b9b6cab972b4c57a50a4fd89615d49638f88d3222dc12192112bde8a35935dac",
    "changed_files": 1,
    "omitted_files": 0,
    "diff_chars": 556,
    "diff_truncated": false,
    "iar_mode": "none",
    "instruction_files_read": []
  },
  "budget": {
    "max_turns": 30,
    "turns_used": 3,
    "tool_calls": 0,
    "risk_tier": "unclassified",
    "verifier_runs": 0
  },
  "outcome": {
    "findings_total": 1,
    "findings_by_severity": {
      "critical": 1,
      "warning": 0,
      "info": 0
    },
    "findings_verified": 0,
    "findings_downgraded": 0,
    "findings_refuted": 0,
    "summary_present": true,
    "gate": {
      "strictness": "lenient",
      "passed": true
    },
    "score": {
      "must_find_total": 1,
      "must_find_hits": 1,
      "false_positives": 0,
      "unlabelled": 0,
      "adjudicated_true": null,
      "adjudicated_false": null
    }
  },
  "usage_known": true,
  "usage": {
    "input_tokens": 14722,
    "cache_read_tokens": 67840,
    "cache_write_tokens": 0,
    "output_tokens": 991,
    "source": "cli"
  },
  "cost_usd": 0.055742,
  "cost_basis": "vendor-reported",
  "timings": {
    "setup_seconds": 0.046,
    "provider_seconds": 120.127,
    "verifier_seconds": null,
    "total_seconds": 120.174
  },
  "status": "completed",
  "failure_class": null,
  "campaign": {
    "id": "phase0-trees-critical",
    "cell": "grok|baseline|C011",
    "repetition": 0,
    "arm": "baseline"
  }
}
