{
  "schema_version": "run-record/3.0",
  "run_id": "run-grok-xai-b6653fa2ff9d-1790252429-3e9cda8c",
  "recorded_at": "2026-09-24T12:20:37Z",
  "runner": "cli",
  "provider": "grok",
  "endpoint_kind": "xai",
  "model": "grok-4.3",
  "model_alias": null,
  "runtime_sha": "ef19c30e943443288b46a280dd314f0225cd98e0",
  "prompt_sha256": "166a8e4b0bf91ffc78d53a2df61332b71ae47e1cd12626b4181df6e71d9582c0",
  "extension_sha256": null,
  "sampling": {
    "requested": {},
    "sent": {},
    "stripped": []
  },
  "context": {
    "repo_kind": "fixture_tree",
    "head_sha": "b6653fa2ff9d07c8c20ac12333cba42a2dbf331d",
    "base_sha": "19059368abc44a479c3a99f7b2346e3c33f9d625",
    "corpus_case_id": "C010",
    "corpus_sha256": "720bd2514d466be944b410b18a226d4bbfc67b057e1bee729866084b530e9bc3",
    "changed_files": 1,
    "omitted_files": 0,
    "diff_chars": 662,
    "diff_truncated": false,
    "iar_mode": "none",
    "instruction_files_read": []
  },
  "budget": {
    "max_turns": 30,
    "turns_used": 8,
    "tool_calls": 0,
    "risk_tier": "unclassified",
    "verifier_runs": 1
  },
  "outcome": {
    "findings_total": 1,
    "findings_by_severity": {
      "critical": 1,
      "warning": 0,
      "info": 0
    },
    "findings_verified": 1,
    "findings_downgraded": 0,
    "findings_refuted": 0,
    "summary_present": true,
    "gate": {
      "strictness": "lenient",
      "passed": true
    },
    "score": {
      "must_find_total": 1,
      "must_find_hits": 1,
      "false_positives": 0,
      "unlabelled": 0,
      "adjudicated_true": null,
      "adjudicated_false": null
    }
  },
  "usage_known": true,
  "usage": {
    "input_tokens": 28170,
    "cache_read_tokens": 191168,
    "cache_write_tokens": 0,
    "output_tokens": 663,
    "source": "cli"
  },
  "cost_usd": 0.0784986,
  "cost_basis": "vendor-reported",
  "timings": {
    "setup_seconds": 0.03,
    "provider_seconds": 37.797,
    "verifier_seconds": 7.268,
    "total_seconds": 37.831
  },
  "status": "completed",
  "failure_class": null,
  "campaign": {
    "id": "exp-grok-4-3",
    "cell": "grok43|verifier-on|C010",
    "repetition": 0,
    "arm": "verifier-on"
  }
}
