{
  "schema_version": "run-record/3.0",
  "run_id": "run-grok-xai-06ca67f08f81-1790266079-1cf13dee",
  "recorded_at": "2026-09-24T16:08:21Z",
  "runner": "cli",
  "provider": "grok",
  "endpoint_kind": "xai",
  "model": "grok-4.5",
  "model_alias": null,
  "runtime_sha": "911f2462cf58ad4f805b68f45fef9593b2a40a07",
  "prompt_sha256": "166a8e4b0bf91ffc78d53a2df61332b71ae47e1cd12626b4181df6e71d9582c0",
  "extension_sha256": null,
  "sampling": {
    "requested": {},
    "sent": {},
    "stripped": []
  },
  "context": {
    "repo_kind": "fixture_tree",
    "head_sha": "06ca67f08f81902d869b5849d9e249b2c5b93e49",
    "base_sha": "119d9921352ea81e4f9ba850ae7818802feb3169",
    "corpus_case_id": "C022",
    "corpus_sha256": "c3fd72f45bc9a929c78f0260867a82f19ce0d8a52cd5d0a14a60c0e2f22d1bbb",
    "changed_files": 1,
    "omitted_files": 0,
    "diff_chars": 606,
    "diff_truncated": false,
    "iar_mode": "none",
    "instruction_files_read": []
  },
  "budget": {
    "max_turns": 30,
    "turns_used": 3,
    "tool_calls": 0,
    "risk_tier": "elevated",
    "verifier_runs": 1
  },
  "outcome": {
    "findings_total": 1,
    "findings_by_severity": {
      "critical": 1,
      "warning": 0,
      "info": 0
    },
    "findings_verified": 1,
    "findings_downgraded": 0,
    "findings_refuted": 0,
    "summary_present": true,
    "gate": {
      "strictness": "lenient",
      "passed": true
    },
    "score": {
      "must_find_total": 1,
      "must_find_hits": 1,
      "false_positives": 0,
      "unlabelled": 0,
      "adjudicated_true": null,
      "adjudicated_false": null
    }
  },
  "usage_known": true,
  "usage": {
    "input_tokens": 30376,
    "cache_read_tokens": 57728,
    "cache_write_tokens": 0,
    "output_tokens": 1667,
    "source": "cli"
  },
  "cost_usd": 0.0880724,
  "cost_basis": "vendor-reported",
  "timings": {
    "setup_seconds": 0.041,
    "provider_seconds": 52.525,
    "verifier_seconds": 21.998,
    "total_seconds": 52.572
  },
  "status": "completed",
  "failure_class": null,
  "campaign": {
    "id": "phase2-rc",
    "cell": "grok|verifier-on|C022",
    "repetition": 0,
    "arm": "verifier-on"
  }
}
