{
  "schema_version": "run-record/3.0",
  "run_id": "run-grok-xai-6d6d23f9ee0c-1790259169-c65c9b6e",
  "recorded_at": "2026-09-24T14:12:59Z",
  "runner": "cli",
  "provider": "grok",
  "endpoint_kind": "xai",
  "model": "grok-4.5",
  "model_alias": null,
  "runtime_sha": "0c26652cd13416b402d4c0b8f1bf9ec7b17de8c1",
  "prompt_sha256": "166a8e4b0bf91ffc78d53a2df61332b71ae47e1cd12626b4181df6e71d9582c0",
  "extension_sha256": null,
  "sampling": {
    "requested": {},
    "sent": {},
    "stripped": []
  },
  "context": {
    "repo_kind": "fixture_tree",
    "head_sha": "6d6d23f9ee0cca11cdbcd2e444bd3dc6c51b6f17",
    "base_sha": "035af410d1ca70101728be7babe771409be8296c",
    "corpus_case_id": "C069",
    "corpus_sha256": "de3ffde9c1cf839d7f319c60ebd2216e794766973bae77c1fd770b988c53c7a0",
    "changed_files": 1,
    "omitted_files": 0,
    "diff_chars": 667,
    "diff_truncated": false,
    "iar_mode": "none",
    "instruction_files_read": []
  },
  "budget": {
    "max_turns": 20,
    "turns_used": 4,
    "tool_calls": 0,
    "risk_tier": "standard",
    "verifier_runs": 1
  },
  "outcome": {
    "findings_total": 2,
    "findings_by_severity": {
      "critical": 1,
      "warning": 1,
      "info": 0
    },
    "findings_verified": 1,
    "findings_downgraded": 0,
    "findings_refuted": 0,
    "summary_present": true,
    "gate": {
      "strictness": "lenient",
      "passed": true
    },
    "score": {
      "must_find_total": 1,
      "must_find_hits": 1,
      "false_positives": 0,
      "unlabelled": 0,
      "adjudicated_true": null,
      "adjudicated_false": null
    }
  },
  "usage_known": true,
  "usage": {
    "input_tokens": 32083,
    "cache_read_tokens": 88320,
    "cache_write_tokens": 0,
    "output_tokens": 2457,
    "source": "cli"
  },
  "cost_usd": 0.105404,
  "cost_basis": "vendor-reported",
  "timings": {
    "setup_seconds": 0.049,
    "provider_seconds": 47.438,
    "verifier_seconds": 10.192,
    "total_seconds": 47.49
  },
  "status": "completed",
  "failure_class": null,
  "campaign": {
    "id": "phase4-tiers-auto",
    "cell": "grok|auto|C069",
    "repetition": 2,
    "arm": "auto"
  }
}
